"SS&C Technologies Holdings, Inc. (SSNC)",22.0,4.8,11.4,6.0,1.0
Sensata Technologies Holding plc (ST),11.0,3.7,3.2,4.5,2.0
"Steel Dynamics, Inc. (STLD)",33.0,10.6,14.4,8.1,1.0
State Street Corporation (STT),24.0,1.6,12.9,9.5,1.0
Seagate Technology Holdings plc (STX),11.0,1.6,3.8,5.3,1.0
"Constellation Brands, Inc. (STZ)",25.0,9.4,10.0,5.2,2.0
Suncor Energy Inc. (SU),32.0,20.6,6.7,4.8,3.0
"Stanley Black & Decker, Inc. (SWK)",25.0,5.0,12.5,7.8,2.0
"Skyworks Solutions, Inc. (SWKS)",28.0,11.8,8.9,7.2,1.0
Synchrony Financial (SYF),17.0,0.1,9.9,7.3,2.0
Stryker Corporation (SYK),28.0,4.0,13.2,11.0,2.0
Sysco Corporation (SYY),16.0,5.4,6.1,4.5,2.0
AT&T Inc. (T),24.0,3.3,13.9,6.7,3.0
TAL Education Group (TAL),18.0,0.1,10.6,7.7,2.0
Molson Coors Beverage Company (TAP),21.0,7.3,8.6,5.5,2.0
Trip.com Group Limited (TCOM),23.0,2.5,11.0,9.8,2.0
The Toronto-Dominion Bank (TD),20.0,0.5,9.7,9.5,3.0
TransDigm Group Incorporated (TDG),39.0,12.0,17.7,9.0,2.0
Teck Resources Limited (TECK),21.0,10.1,6.7,3.6,3.0
"Telefónica, S.A. (TEF)",17.0,1.6,9.2,6.6,2.0
TE Connectivity Ltd. (TEL),15.0,5.8,4.4,4.6,0.0
"Teradyne, Inc. (TER)",17.0,7.1,4.9,5.0,0.0
Teleflex Incorporated (TFX),30.0,4.8,16.1,8.7,2.0
Target Corporation (TGT),14.0,1.9,7.6,4.9,3.0
"THOR Industries, Inc. (THO)",27.0,5.9,14.9,5.7,0.0
"The TJX Companies, Inc. (TJX)",14.0,1.9,7.7,4.8,2.0
Thermo Fisher Scientific Inc. (TMO),13.0,1.4,4.9,6.5,3.0
"T-Mobile US, Inc. (TMUS)",25.0,4.2,13.4,7.1,3.0
Travel + Leisure Co. (TNL),25.0,9.5,11.2,4.1,2.0
"Toll Brothers, Inc. (TOL)",23.0,9.6,7.8,5.1,2.0
"Tapestry, Inc. (TPR)",15.0,1.1,8.6,5.2,2.0
Targa Resources Corp. (TRGP),33.0,14.2,14.8,4.2,2.0
Thomson Reuters Corporation (TRI),15.0,0.0,8.0,6.5,2.0
"Tripadvisor, Inc. (TRIP)",25.0,1.1,14.9,8.9,2.0
Trimble Inc. (TRMB),12.0,3.8,3.4,5.2,0.0
"T. Rowe Price Group, Inc. (TROW)",17.0,2.4,8.9,5.6,1.0
TC Energy Corporation (TRP),23.0,10.4,10.1,3.0,3.0
"The Travelers Companies, Inc. (TRV)",20.0,1.0,9.3,10.0,1.0
Tractor Supply Company (TSCO),16.0,3.4,8.2,4.5,2.0
"Tesla, Inc. (TSLA)",25.0,3.3,14.1,7.8,3.0
"Tyson Foods, Inc. (TSN)",36.0,14.0,12.4,9.5,4.0
Trane Technologies plc (TT),15.0,4.4,5.7,5.1,2.0
The Toro Company (TTC),21.0,5.4,9.4,6.4,1.0
TELUS Corporation (TU),17.0,3.4,10.6,3.4,2.0
Texas Instruments Incorporated (TXN),21.0,7.8,6.0,6.9,2.0
Textron Inc. (TXT),34.0,10.9,16.1,6.6,2.0
"Under Armour, Inc. (UAA)",16.0,1.8,8.5,6.0,2.0
"United Airlines Holdings, Inc. (UAL)",29.0,10.8,12.8,5.0,2.0
UBS Group AG (UBS),28.0,1.0,12.5,14.7,4.0
"UDR, Inc. (UDR)",14.0,3.7,3.9,6.3,1.0
UGI Corporation (UGI),32.0,12.5,13.3,5.8,2.0
U-Haul Holding Company (UHAL),23.0,6.6,9.2,7.3,1.0
"Universal Health Services, Inc. (UHS)",33.0,3.7,20.7,8.6,3.0
"Ulta Beauty, Inc. (ULTA)",16.0,4.1,7.3,4.3,2.0
UnitedHealth Group Incorporated (UNH),15.0,0.0,9.7,5.6,3.0
Unum Group (UNM),17.0,0.8,8.9,7.7,1.0
Union Pacific Corporation (UNP),23.0,7.3,10.6,5.6,2.0
"United Parcel Service, Inc. (UPS)",19.0,4.2,8.9,5.5,2.0
"United Rentals, Inc. (URI)",17.0,5.3,6.1,5.4,1.0
U.S. Bancorp (USB),30.0,1.8,15.5,13.0,3.0
United Therapeutics Corporation (UTHR),22.0,1.4,13.8,7.1,2.0
Visa Inc. (V),17.0,1.8,8.2,6.7,3.0
V.F. Corporation (VFC),14.0,0.8,8.2,5.0,2.0
Vipshop Holdings Limited (VIPS),24.0,7.3,8.0,8.2,2.0
Valero Energy Corporation (VLO),33.0,20.1,7.4,5.0,2.0
Vulcan Materials Company (VMC),29.0,13.4,6.8,9.1,2.0
Vornado Realty Trust (VNO),14.0,3.1,4.2,7.0,1.0
"Voya Financial, Inc. (VOYA)",18.4,1.6,7.8,9.0,2.0
"Verisk Analytics, Inc. (VRSK)",18.0,0.1,12.5,5.0,1.0
"VeriSign, Inc. (VRSN)",21.0,4.7,10.8,5.8,1.0
Vertex Pharmaceuticals Incorporated (VRTX),23.0,0.8,15.4,6.6,2.0
"Ventas, Inc. (VTR)",13.0,3.4,3.9,5.6,0.0
Verizon Communications Inc. (VZ),19.0,3.7,9.6,5.4,3.0
Westinghouse Air Brake Technologies Corporation (WAB),23.0,5.4,12.0,6.0,2.0
Waters Corporation (WAT),15.0,1.4,8.2,5.1,0.0
"Walgreens Boots Alliance, Inc. (WBA)",16.0,1.8,9.3,5.2,3.0
"Waste Connections, Inc. (WCN)",22.0,11.0,7.7,3.3,1.0
"Workday, Inc. (WDAY)",17.0,4.0,6.6,6.6,1.0
Western Digital Corporation (WDC),11.0,1.5,3.9,6.1,2.0
"WEC Energy Group, Inc. (WEC)",27.0,13.4,9.0,5.1,1.0
Welltower Inc. (WELL),13.0,4.2,3.5,5.5,1.0
Wells Fargo & Company (WFC),36.0,2.0,14.8,19.4,5.0
Whirlpool Corporation (WHR),16.0,4.6,7.1,4.4,2.0
Westlake Corporation (WLK),29.0,17.9,3.2,8.3,2.0
"Waste Management, Inc. (WM)",17.0,8.1,5.2,3.3,2.0
"The Williams Companies, Inc. (WMB)",22.0,8.7,10.1,3.0,2.0
Walmart Inc. (WMT),25.0,5.9,12.4,7.1,3.0
W. P. Carey Inc. (WPC),16.0,4.2,5.0,6.5,0.0
Wheaton Precious Metals Corp. (WPM),7.0,0.1,2.7,4.6,0.0
W. R. Berkley Corporation (WRB),22.0,2.0,7.9,11.9,1.0
"Essential Utilities, Inc. (WTRG)",25.0,6.8,11.4,6.4,1.0
Willis Towers Watson Public Limited Company (WTW),19.0,0.1,7.8,10.8,2.0
The Western Union Company (WU),15.0,4.4,6.0,4.9,1.0
Weyerhaeuser Company (WY),17.0,9.1,4.2,3.5,2.0
"Wynn Resorts, Limited (WYNN)",26.0,3.4,11.8,10.6,2.0
United States Steel Corporation (X),30.0,14.5,9.7,6.2,3.0
Xcel Energy Inc. (XEL),26.0,12.7,9.3,4.5,2.0
Exxon Mobil Corporation (XOM),42.0,23.1,10.0,8.5,3.0
DENTSPLY SIRONA Inc. (XRAY),15.0,2.1,6.5,6.3,1.0
Xylem Inc. (XYL),18.0,4.3,8.7,5.2,1.0
"Yum! Brands, Inc. (YUM)",20.0,4.5,11.4,4.1,2.0
"Zillow Group, Inc. (Z)",22.0,1.2,11.5,9.5,2.0
"Zimmer Biomet Holdings, Inc. (ZBH)",26.0,3.6,14.5,7.9,2.0
Zoetis Inc. (ZTS),19.0,3.2,6.8,8.7,2.0
